"Category","Before","After"
"Documentation","Minimal README.md, SUMMARY.md","Added RESEARCH.md, updated SUGGESTIONS.md with comprehensive details"
"Repository Structure","5 main tool categories, platforms, services directories","Detailed understanding of 3,299+ tools across 5 categories, 12+ platforms, 14+ services"
"Tools Count","Estimated ~1,000+ tools","Accurate count: 3,299 Python automation tools (653 analysis, 703 cleanup, 955 dedup, 113 rename, 875 scanners)"
"Platform Integrations","Unknown scope","Identified 12+ platform integrations (YouTube, Instagram, TikTok, etc.)"
"AI/ML Service Integrations","Unknown scope","Identified 14+ AI/ML service integrations (OpenAI, Claude, Gemini, etc.)"
"Media Processing","Unknown scope","Identified 506+ media processing tools across audio, image, video, transcription, TTS"
"Data Processing","Unknown scope","Identified data processing tools in converters, CSV, JSON directories"
"Code Quality Assessment","No assessment","Identified code quality issues (undefined variables, incomplete refactoring)"
"Repository Architecture","Surface understanding","Detailed understanding of directory structure, tool categorization, versioning patterns"
"Integration Capabilities","Unknown","Comprehensive understanding of platform and service integration capabilities"
"Documentation Quality","Basic","Enhanced with detailed analysis, research findings, and improvement suggestions"
"Tool Categorization","Basic","Detailed categorization with specific examples and functionality descriptions"
"Versioning System","Unknown","Understanding of sophisticated versioning with tool variants (tool_1.py, tool_1_1.py, etc.)"
"Media Tools Count","Unknown","Accurate count: 506+ Python tools for media processing"
"Recommended Improvements","None","Comprehensive suggestions with 4-phase implementation plan"
"Integration Opportunities","Unknown","Identified Apify, Notion, and other integration possibilities"
"Architecture Insights","None","Detailed insights into tool functionality, safety features, and common patterns"