"file_path","category","description","imports","apis_used","technologies","complexity","num_functions","num_classes"
/Users/steven/pythons/apis/setup_sphinx_docs.py,Documentation Generation,"Sphinx Documentation Setup Script. Creates comprehensive documentation for all Python projects. Checks dependencies, creates directory structure, initializes Sphinx, generates conf.py, index.rst, overview, category pages, API docs, tutorials, examples, custom CSS, and a Makefile, then builds the documentation.","asyncio, aiohttp, functools, logging, abc, dataclasses, threading, lru_cache, html, sys, pathlib, json, os, subprocess, typing, http.server, socketserver, webbrowser","Sphinx, Documentation","sphinx, sphinx-rtd-theme, sphinx-autodoc-typehints, myst-parser, sphinxcontrib-mermaid",14,0
/Users/steven/pythons/apis/setup_sphinx_docs_uv.py,Documentation Generation & UV Package Management,"Sphinx Documentation Setup Script (UV Compatible). Creates comprehensive documentation for all Python projects. Identical to setup_sphinx_docs.py but uses 'uv add' for package installation, falling back to pip.","asyncio, aiohttp, functools, logging, abc, dataclasses, threading, lru_cache, html, sys, pathlib, json, os, subprocess, typing, http.server, socketserver, webbrowser","Sphinx, Documentation, UV","sphinx, sphinx-rtd-theme, sphinx-autodoc-typehints, myst-parser, sphinxcontrib-mermaid",14,0
/Users/steven/pythons/apis/sheets.py,Google Sheets Automation & Integration,"Google Sheets helper using gspread. Supports OAuth (Installed App or Service Account) for authentication. Provides functions to load the gspread client, open a spreadsheet by ID, ensure a worksheet exists, set headers, replace rows, and append unique rows.","os, typing, gspread, google.oauth2.service_account, google.oauth2.credentials, google.auth.transport.requests, google_auth_oauthlib.flow","Google Sheets, OAuth","gspread, google-auth-oauthlib, google-auth",7,0
/Users/steven/pythons/apis/simple_docs_generator.py,Documentation Generation & Web Development,"Simple HTML Documentation Generator. Creates a comprehensive HTML documentation website without Sphinx dependencies. Handles directory structure, loads script data, generates CSS, JavaScript, and HTML pages (index, categories, tutorials), and a README.","asyncio, aiohttp, functools, logging, abc, dataclasses, threading, lru_cache, html, datetime, find_script, pathlib, typing, json, os","HTML, Documentation, Web Development",,12,0
/Users/steven/pythons/apis/smart-conservative-renamer.py,File Management & Renaming,"Smart Conservative Renamer. Renames Python files based on content and parent folder context, aiming to keep good names and fix bad ones. Uses AST analysis, pattern matching, and provides dry-run, undo script, and CSV reporting features.","ast, csv, os, re, datetime, pathlib, typing, logging","File Renaming, AST, Content Analysis",,10,0
/Users/steven/pythons/apis/smart-content-renamer-v3.py,Advanced File Management & Renaming (AI-Powered),"Intelligent File Renaming with Deep Semantic Analysis (V3). Uses deep AST parsing, semantic analysis of imports/functions/classes, purpose inference, AI-powered name suggestions, duplicate detection, and interactive review. Generates JSON, CSV, and Markdown reports.","ast, re, json, csv, pathlib, datetime, collections, typing, dataclasses","File Renaming, AI, Semantic Analysis, AST",,10,0
/Users/steven/pythons/apis/smart-rename-versions.py,File Management & Versioning,"Smart Version Renaming utility. Analyzes script purpose (e.g., browser automation, API, batch processing) and renames versioned scripts to a descriptive format: original-v{N}-{purpose}.py. Relies on a VERSION_ANALYSIS_REPORT.json and creates a rename plan and summary.","json, pathlib, re","File Renaming, Version Control",,3,0
/Users/steven/pythons/apis/snoopplugins.py,OSINT & Network Analysis,"Contains 'Snoop Project/Черновик' plugins in Russian. Includes modules for Yandex parsing (login, disk link, user ID), Reverse Geocoder (file-based coordinate processing), and GEO_IP/domain analysis (IP/domain lookup, threading for timeouts).","pathlib, ipaddress, json, locale, os, platform, re, random, requests, signal, socket, sys, threading, time, webbrowser, colorama, rich.console, rich.progress, rich.table, urllib.parse, snoopbanner","OSINT, Network Analysis, Yandex API","requests, colorama, rich",18,0
/Users/steven/pythons/apis/social-platforms-instagram-bot-error.py,Social Media Automation & Bot Utility,"Instagram Bot. Performs actions like liking, commenting, viewing stories, and commenting on 'draw' photos. Uses Selenium to automate browser interactions, pyfiglet for ASCII art, and geckodriver for Firefox.","logging, os, platform, pathlib, time, pyfiglet, selenium.webdriver.common.keys, selenium.webdriver","Instagram, Bot, Selenium","selenium, pyfiglet",7,0
/Users/steven/pythons/apis/society6-upload.py,Web Automation & E-commerce,"Society6 Uploader. Automates logging into Society6, navigating to the upload page, and uploading images using Selenium and pyautogui for file dialog interaction.","time, pyautogui, selenium.webdriver","Society6, E-commerce, Automation","selenium, pyautogui",3,0
/Users/steven/pythons/apis/sphinxext.py,Documentation Generation & Sphinx Extension,"Sphinx extension to generate automatic documentation of lexers, formatters and filters for Pygments. Uses Sphinx directives to collect and document Pygments components, including generating tabular overviews of lexers.","asyncio, aiohttp, functools, logging, abc, dataclasses, threading, lru_cache, pip._vendor.pygments.filters, pip._vendor.pygments.formatters, pip._vendor.pygments.lexers, docutils, sphinx.util.nodes, typing, sys","Sphinx, Pygments, Documentation",,14,0
/Users/steven/pythons/apis/splt.py,File Processing & HTML Utility,"HTML Chunk Splitter. Loads a large HTML file and splits its content into smaller chunks based on specific HTML tags (div, section, article). Falls back to splitting by fixed character length if no tags found.","pathlib, os, bs4, logging",HTML Processing,beautifulsoup4,4,0
/Users/steven/pythons/apis/stability-format.py,"Content Generation, SEO & Web Automation","Format-Optimized Medium Article Automation. Analyzes Python folders, categorizes files, identifies technologies and keywords, and then generates SEO-optimized Medium articles in HTML, JSON, and CSV formats. Includes detailed formatting for article structure.","json, csv, re, pathlib, datetime, collections, subprocess, logging","Medium, SEO, Article Generation",,7,0
/Users/steven/pythons/apis/stability-medium.py,"Content Generation, SEO & Web Automation","Medium Article Automation Maker. Analyzes Python projects, generates SEO-optimized Medium articles with trending content, and professional formatting. Identifies project types (AI/ML, automation, data analysis, web development), technologies, and keywords.","json, csv, re, pathlib, datetime, collections, subprocess, logging","Medium, SEO, Article Generation",,7,0
/Users/steven/pythons/apis/streamlabs-polly.py,TTS & Audio Generation,"Streamlabs Polly Text-to-Speech (TTS) client. Uses the Streamlabs Polly API to convert text to speech, supporting random voice selection and checking for API ratelimits.","random, requests, utils.settings, utils.voice, logging","Streamlabs Polly, TTS",requests,5,0
/Users/steven/pythons/apis/sub.py,Audio Processing & Transcription,"AssemblyAI API client for audio transcription. Handles uploading audio files to AssemblyAI, transcribing them, polling for results, and saving the transcript as an SRT file.","requests, time, os, config","AssemblyAI, Audio Transcription",requests,4,0
/Users/steven/pythons/apis/sufflecsv.py,Data Manipulation & CSV Utility,"CSV Shuffler. Downloads CSV data from a URL, shuffles its rows randomly, and then prompts the user for a destination file path to save the shuffled CSV.","csv, random, io, requests","CSV, Data Shuffling",requests,4,0
/Users/steven/pythons/apis/suno-content-creation-suno.py,Web Scraping & Data Extraction,"Suno-like grid HTML scraper. Extracts song information (titles, URLs, cover images, time, keys/tags) from HTML pages with a specific Suno-like grid structure and outputs it into a CSV file.","argparse, csv, pathlib, typing, urllib.parse, pandas, bs4","Suno, Web Scraping","pandas, beautifulsoup4",6,0
/Users/steven/pythons/apis/suno-data-processor.py,"Data Processing, Analytics & Audio Utility","Suno Data Processor. Processes exported Suno data (CSV/JSON) performing validation, cleaning, deduplication, analytics, and format conversions (DistroKid CSV, M3U playlist, Markdown report). Optionally downloads audio and can perform AI-powered genre/mood classification.","argparse, csv, json, re, sys, collections, datetime, pathlib, typing, hashlib, pandas, requests, openai","Suno, Data Processing, AI","pandas, requests, openai",13,0
/Users/steven/pythons/apis/suno-extract-songs.py,Web Scraping & Data Extraction,"Suno Song Details Extractor. Extracts song details (title, URL, cover, genre, time) from HTML files. Provides options to prompt for file paths or use predefined ones and saves the extracted data to a CSV.","pathlib, re, bs4, pandas, os, logging","Suno, Web Scraping","pandas, beautifulsoup4",7,0
/Users/steven/pythons/apis/suno-extract-suno-html.py,Web Scraping & Data Extraction,"Suno HTML Batch Extractor. Extracts song data (ID, title, URL, audioUrl, imageUrl, videoUrl, duration, author, published, plays, likes, tags, prompt/lyrics, isPublic, modelVersion) from saved Suno HTML files, prioritizing __NEXT_DATA__ JSON and falling back to HTML parsing. Saves to CSV.","argparse, csv, json, re, pathlib, datetime, typing, bs4","Suno, HTML Parsing",beautifulsoup4,9,0
/Users/steven/pythons/apis/suno-html-scraper.py,Web Scraping & Data Extraction,Suno HTML Scraper. Extracts song details from HTML content using BeautifulSoup and Pandas. Outputs to CSV. Appears to be an iteration or alternative approach to Suno data extraction.,"pathlib, os, pandas, bs4, logging","Suno, HTML Parsing","pandas, beautifulsoup4",5,0
/Users/steven/pythons/apis/suno-html-splitter.py,HTML Processing & File Management,"HTML Splitter for Suno-like Content. Splits large HTML files into smaller chunks based on div, section, or article tags, or by character count. Useful for managing large exported pages.","pathlib, os, bs4, logging",HTML Processing,beautifulsoup4,4,0
/Users/steven/pythons/apis/suno-music-sort-dedup.py,"File Management, Deduplication & Organization","Advanced Sort and Deduplication Tool for Python music processing directories. Finds exact duplicates, similar files, analyzes content (quality, category), organizes into a CLEAN_ORGANIZED structure, and archives duplicates. Generates Markdown and JSON reports.","os, logging, shutil, hashlib, json, pathlib, typing, collections, re, datetime","File Management, Deduplication, Music",,10,0
/Users/steven/pythons/apis/suno-scrape-suno-api.py,Web Scraping & Data Extraction,"Suno AI Scraper - Complete CSV Exporter. Scrapes Suno AI playlists and songs, extracting details like song name, links, audio/image URLs, author, duration, play/like counts, styles, and lyrics. Uses requests and BeautifulSoup. Outputs to CSV/JSON.","argparse, csv, json, re, sys, datetime, pathlib, typing, urllib.parse, requests, bs4","Suno, Web Scraping","requests, beautifulsoup4",11,0
/Users/steven/pythons/apis/synthesize.py,TTS & Audio Generation,"Text-to-Speech (TTS) System. Provides a base TTSProvider class and implementations for ElevenLabs, AssemblyAI, and Deepgram. Loads API keys from .env.d or .env files. Generic TTS client for multiple providers.","os, sys, pathlib, requests, dotenv","TTS, ElevenLabs, AssemblyAI, Deepgram",requests,5,0
/Users/steven/pythons/apis/system-monitor.py,System Monitoring & API Health Check,"AI System Health Monitor. Tests the health of critical AI APIs (OpenAI, Deepgram, ElevenLabs, HuggingFace, Remove.bg) by making API calls and checking responses. Generates a report and can send alerts to Telegram.","pathlib, os, requests, datetime, typing","AI, API Monitoring, Health Check, Telegram",requests,5,0
/Users/steven/pythons/apis/telegraph-download-images.py,Web Scraping & File Downloading,"Telegraph Image Downloader (in Russian). Downloads images from Telegraph and Teletype articles. Supports single URLs or files with multiple URLs, handles creating folders, renaming files, and uses multithreading for downloads.","threading, msvcrt, os, re, subprocess, sys, time, traceback, urllib.request, requests, bs4","Web Scraping, Image Download, Multithreading","requests, beautifulsoup4",12,0
/Users/steven/pythons/apis/test_bot.py,Testing & Bot Development Utility,"TestBot for an Instagram bot. Uses the instabot library and provides test cases for login, UUID generation, user setup, and counter resetting. Leverages unittest for testing.","re, json, datetime, typing, pathlib, sys, os, logging, abc, dataclasses, threading, uuid, mock, unittest.mock, functools, instabot, requests","Instagram, Bot, Testing, Instabot","instabot, requests",15,0
/Users/steven/pythons/apis/test_framework.py,Software Testing & Development Utility,"Comprehensive Testing Framework. Provides unit, integration, and performance testing capabilities. It can run all tests, create test templates, measure execution time, benchmark functions, and test file/network operations.","requests, dataclasses, functools, pathlib, typing, asyncio, json, logging, os, shutil, subprocess, sys, tempfile, time, unittest","Testing, Unit Test, Integration Test, Performance Test",requests,15,0
/Users/steven/pythons/apis/test_netlify_uploader.py,Testing & Deployment Utility,"Netlify Uploader Test Case. Uses unittest and mock to test the Netlify uploader functionality, including authorization token retrieval, site ID fetching, and deployment to Netlify.","requests, dataclasses, functools, pathlib, typing, unittest, mock, simplegallery.upload.uploader_factory, simplegallery.upload.variants.netlify_uploader, testfixtures","Netlify, Deployment, Testing",requests,9,0
/Users/steven/pythons/apis/thinketh-tts-adaptive.py,Audiobook Generation & TTS,"Adaptive Emotional Audiobook Generator (Cheerful Guide Style). Synthesizes text from DOCX files into audio using OpenAI's TTS (preferring gpt-4o-tts) with a fallback to HF Bark. Applies a 'cheerful guide' style, splits text into chunks, and combines audio segments with normalization.","os, pathlib, dotenv, docx, pydub, requests","TTS, Audiobook, OpenAI, HuggingFace","pydub, python-dotenv, requests",6,0
/Users/steven/pythons/apis/thinketh-tts-asmr.py,Audiobook Generation & ASMR Audio,"ASMR whisper edition with cheerful-guide affect. Synthesizes text from DOCX files into ASMR audio using OpenAI/HF Bark TTS. Includes features like ambient overlay (randomly chosen), binaural widening, and mastering with normalization.","os, random, pathlib, dotenv, docx, pydub, requests","TTS, Audiobook, ASMR, OpenAI, HuggingFace","pydub, python-dotenv, requests",6,0
/Users/steven/pythons/apis/thinketh-tts-scripty.py,Audiobook Generation & Cinematic Audio,"Cinematic hybrid edition audiobook generator. Synthesizes text from DOCX files into cinematic audio using dynamic voice rotation, ambient overlays per chapter, widening, fades, and mastering. Applies a 'cheerful-guide' affect.","os, random, pathlib, dotenv, docx, pydub, requests","TTS, Audiobook, Cinematic, OpenAI, HuggingFace","pydub, python-dotenv, requests",6,0
/Users/steven/pythons/apis/thinketh-tts-transcription.py,Audiobook Generation & TTS,"Text-to-Speech generator for 'As A Man Thinketh'. Reads DOCX files, splits into chapters, chunks text for token limits, synthesizes each chunk using OpenAI's TTS, and merges into one MP3 per chapter. Skips already completed files.","os, pathlib, dotenv, docx, pydub, openai, requests","TTS, Audiobook, OpenAI","pydub, python-dotenv, openai",7,0
/Users/steven/pythons/apis/thinketh-tts-universal.py,TTS & Audio Generation,Universal Text-to-Speech (TTS) System. Synthesizes text from DOCX/TXT files using OpenAI's TTS (prioritizing models) with a fallback to HuggingFace Bark. Includes an optional ambient background mix. General-purpose TTS and audio generation utility.,"os, pathlib, dotenv, openai, pydub, requests","TTS, Audiobook, OpenAI, HuggingFace","pydub, python-dotenv, openai",5,0
/Users/steven/pythons/apis/thumbnail.py,Video Utility & Data Processing,"YouTube Thumbnail Downloader. Reads a CSV of YouTube video URLs, fetches video details using the YouTube Data API, downloads high-resolution thumbnails, and updates the CSV with thumbnail paths and video metadata.","os, pathlib, pandas, requests, googleapiclient.discovery","YouTube, Thumbnails, Data Processing","pandas, requests, google-api-python-client",5,0
/Users/steven/pythons/apis/translate.py,Language Processing & API Client,Google Translate and Language Detection Library. Provides Translator and LanguageDetector classes to translate text between languages and detect the language of a given message. Interfaces with Google's translation services.,"asyncio, aiohttp, functools, logging, abc, dataclasses, threading, lru_cache, browser, urllib.parse, simplejson, sys, os, requests","Google Translate, Language Detection","aiohttp, requests",13,0
/Users/steven/pythons/apis/twitch-download.py,Web Scraping & API Client,"Twitch API Client. Provides functions to make requests to the Twitch Helix API, including fetching clip data, user information, and top clips. Handles authentication with OAuth tokens and client IDs.",requests,"Twitch, API Client",requests,1,0
/Users/steven/pythons/apis/unified-organizer.py,File Management & Organization,"Unified File Organizer. Combines various organization functionalities: file type-based, CSV-based structured moves, and music album organization (by filename or metadata). Includes content analysis for Python files and supports dry-run/preview modes.","os, csv, re, shutil, pathlib, collections","File Management, Organization",,6,0
/Users/steven/pythons/apis/suno-extract-suno-html.py,Web Scraping & Data Extraction,"Suno HTML Batch Extractor. Extracts song data (ID, title, URL, audioUrl, imageUrl, videoUrl, duration, author, published, plays, likes, tags, prompt/lyrics, isPublic, modelVersion) from saved Suno HTML files, prioritizing __NEXT_DATA__ JSON and falling back to HTML parsing. Saves to CSV.","argparse, csv, json, re, pathlib, datetime, typing, bs4","Suno, HTML Parsing",beautifulsoup4,9,0
/Users/steven/pythons/apis/suno-html-scraper.py,Web Scraping & Data Extraction,Suno HTML Scraper. Extracts song details from HTML content using BeautifulSoup and Pandas. Outputs to CSV. Appears to be an iteration or alternative approach to Suno data extraction.,"pathlib, os, pandas, bs4, logging","Suno, HTML Parsing","pandas, beautifulsoup4",5,0
/Users/steven/pythons/apis/suno-html-splitter.py,HTML Processing & File Management,"HTML Splitter for Suno-like Content. Splits large HTML files into smaller chunks based on div, section, or article tags, or by character count. Useful for managing large exported pages.","pathlib, os, bs4, logging",HTML Processing,beautifulsoup4,4,0
/Users/steven/pythons/apis/suno-music-sort-dedup.py,"File Management, Deduplication & Organization","Advanced Sort and Deduplication Tool for Python music processing directories. Finds exact duplicates, similar files, analyzes content (quality, category), organizes into a CLEAN_ORGANIZED structure, and archives duplicates. Generates Markdown and JSON reports.","os, logging, shutil, hashlib, json, pathlib, typing, collections, re, datetime","File Management, Deduplication, Music",,10,0
/Users/steven/pythons/apis/suno-scrape-suno-api.py,Web Scraping & Data Extraction,"Suno AI Scraper - Complete CSV Exporter. Scrapes Suno AI playlists and songs, extracting details like song name, links, audio/image URLs, author, duration, play/like counts, styles, and lyrics. Uses requests and BeautifulSoup. Outputs to CSV/JSON.","argparse, csv, json, re, sys, datetime, pathlib, typing, urllib.parse, requests, bs4","Suno, Web Scraping","requests, beautifulsoup4",11,0
/Users/steven/pythons/apis/synthesize.py,TTS & Audio Generation,"Text-to-Speech (TTS) System. Provides a base TTSProvider class and implementations for ElevenLabs, AssemblyAI, and Deepgram. Loads API keys from .env.d or .env files. Generic TTS client for multiple providers.","os, sys, pathlib, requests, dotenv","TTS, ElevenLabs, AssemblyAI, Deepgram",requests,5,0
/Users/steven/pythons/apis/system-monitor.py,System Monitoring & API Health Check,"AI System Health Monitor. Tests the health of critical AI APIs (OpenAI, Deepgram, ElevenLabs, HuggingFace, Remove.bg) by making API calls and checking responses. Generates a report and can send alerts to Telegram.","pathlib, os, requests, datetime, typing","AI, API Monitoring, Health Check, Telegram",requests,5,0
/Users/steven/pythons/apis/telegraph-download-images.py,Web Scraping & File Downloading,"Telegraph Image Downloader (in Russian). Downloads images from Telegraph and Teletype articles. Supports single URLs or files with multiple URLs, handles creating folders, renaming files, and uses multithreading for downloads.","threading, msvcrt, os, re, subprocess, sys, time, traceback, urllib.request, requests, bs4","Web Scraping, Image Download, Multithreading","requests, beautifulsoup4",12,0
/Users/steven/pythons/apis/test_bot.py,Testing & Bot Development Utility,"TestBot for an Instagram bot. Uses the instabot library and provides test cases for login, UUID generation, user setup, and counter resetting. Leverages unittest for testing.","re, json, datetime, typing, pathlib, sys, os, logging, abc, dataclasses, threading, uuid, mock, unittest.mock, functools, instabot, requests","Instagram, Bot, Testing, Instabot","instabot, requests",15,0
/Users/steven/pythons/apis/test_framework.py,Software Testing & Development Utility,"Comprehensive Testing Framework. Provides unit, integration, and performance testing capabilities. It can run all tests, create test templates, measure execution time, benchmark functions, and test file/network operations.","requests, dataclasses, functools, pathlib, typing, asyncio, json, logging, os, shutil, subprocess, sys, tempfile, time, unittest","Testing, Unit Test, Integration Test, Performance Test",requests,15,0
/Users/steven/pythons/apis/test_netlify_uploader.py,Testing & Deployment Utility,"Netlify Uploader Test Case. Uses unittest and mock to test the Netlify uploader functionality, including authorization token retrieval, site ID fetching, and deployment to Netlify.","requests, dataclasses, functools, pathlib, typing, unittest, mock, simplegallery.upload.uploader_factory, simplegallery.upload.variants.netlify_uploader, testfixtures","Netlify, Deployment, Testing",requests,9,0
/Users/steven/pythons/apis/thinketh-tts-adaptive.py,Audiobook Generation & TTS,"Adaptive Emotional Audiobook Generator (Cheerful Guide Style). Synthesizes text from DOCX files into audio using OpenAI's TTS (preferring gpt-4o-tts) with a fallback to HF Bark. Applies a 'cheerful guide' style, splits text into chunks, and combines audio segments with normalization.","os, pathlib, dotenv, docx, pydub, requests","TTS, Audiobook, OpenAI, HuggingFace","pydub, python-dotenv, requests",6,0
/Users/steven/pythons/apis/thinketh-tts-asmr.py,Audiobook Generation & ASMR Audio,"ASMR whisper edition with cheerful-guide affect. Synthesizes text from DOCX files into ASMR audio using OpenAI/HF Bark TTS. Includes features like ambient overlay (randomly chosen), binaural widening, and mastering with normalization.","os, random, pathlib, dotenv, docx, pydub, requests","TTS, Audiobook, ASMR, OpenAI, HuggingFace","pydub, python-dotenv, requests",6,0
/Users/steven/pythons/apis/thinketh-tts-scripty.py,Audiobook Generation & Cinematic Audio,"Cinematic hybrid edition audiobook generator. Synthesizes text from DOCX files into cinematic audio using dynamic voice rotation, ambient overlays per chapter, widening, fades, and mastering. Applies a 'cheerful-guide' affect.","os, random, pathlib, dotenv, docx, pydub, requests","TTS, Audiobook, Cinematic, OpenAI, HuggingFace","pydub, python-dotenv, requests",6,0
/Users/steven/pythons/apis/thinketh-tts-transcription.py,Audiobook Generation & TTS,"Text-to-Speech generator for 'As A Man Thinketh'. Reads DOCX files, splits into chapters, chunks text for token limits, synthesizes each chunk using OpenAI's TTS, and merges into one MP3 per chapter. Skips already completed files.","os, pathlib, dotenv, docx, pydub, openai, requests","TTS, Audiobook, OpenAI","pydub, python-dotenv, openai",7,0
/Users/steven/pythons/apis/thinketh-tts-universal.py,TTS & Audio Generation,Universal Text-to-Speech (TTS) System. Synthesizes text from DOCX/TXT files using OpenAI's TTS (prioritizing models) with a fallback to HuggingFace Bark. Includes an optional ambient background mix. General-purpose TTS and audio generation utility.,"os, pathlib, dotenv, openai, pydub, requests","TTS, Audiobook, OpenAI, HuggingFace","pydub, python-dotenv, openai",5,0
/Users/steven/pythons/apis/thumbnail.py,Video Utility & Data Processing,"YouTube Thumbnail Downloader. Reads a CSV of YouTube video URLs, fetches video details using the YouTube Data API, downloads high-resolution thumbnails, and updates the CSV with thumbnail paths and video metadata.","os, pathlib, pandas, requests, googleapiclient.discovery","YouTube, Thumbnails, Data Processing","pandas, requests, google-api-python-client",5,0
