"file_path","category","description","imports","apis_used","technologies","complexity","num_functions","num_classes"
"/Users/steven/pythons/meta_agent.py","Automation & Scripting","An orchestrator script designed to run other tools in a sequence, starting with a 'refactor' phase and followed by an 'analyze' phase using `git-ai`.","argparse,subprocess,json","","","low",4,0
"/Users/steven/pythons/adobe_style_analyzer/style_analyzer.py","Media Processing (Audio, Video, Image)","A tool for analyzing Adobe ASL (style library) files. It extracts styles, categorizes them, generates reports, and creates visual previews.","os,zipfile,xml.etree.ElementTree,json,collections,shutil,pathlib,PIL","Adobe","Pillow","high",8,1
"/Users/steven/pythons/adobe_style_analyzer/try.py","Testing & Utilities","A test script or an early version for analyzing ASL files.","os,xml.etree.ElementTree,json,collections,pathlib","Adobe","","low",4,1
"/Users/steven/pythons/advanced_code_analyzer.py","Code & Project Analysis","A static code analysis tool for Python. It uses AST to check for complexity, security vulnerabilities, style issues, and documentation quality.","os,sys,ast,json,logging,argparse,pathlib,typing,dataclasses,collections,re,subprocess,concurrent.futures","","AST","high",15,6
"/Users/steven/pythons/advanced_consolidation_strategy.py","Code & Project Analysis","A script that analyzes existing deduplication reports to generate a multi-phase consolidation strategy for a codebase. It can also generate a shell script to execute the strategy.","json,csv,collections,os,pathlib","","","medium",3,0
"/Users/steven/pythons/ADVANCED_CONTENT_AWARE_ANALYZER.py","Code & Project Analysis","A sophisticated file analyzer that uses semantic analysis and AST-based code intelligence to categorize files, assess their quality, and suggest destinations.","os,sys,json,ast,hashlib,mimetypes,re,csv,pathlib,typing,dataclasses,datetime,collections,chardet,traceback","","AST,Chardet","high",22,6
"/Users/steven/pythons/advanced_file_deduplicator.py","File & Directory Management","A tool for finding and removing duplicate files with multiple comparison strategies (hash, size) and safety features like backups and dry-run mode.","os,sys,json,hashlib,shutil,logging,pathlib,collections,datetime,typing,dataclasses,argparse,fnmatch,concurrent.futures","","","high",11,2
"/Users/steven/pythons/advanced_structure_analyzer.py","Code & Project Analysis","A tool for analyzing the folder structure of the `AVATARARTS` project. It maps parent-child relationships and analyzes README files to infer the purpose of a directory.","os,json,hashlib,pathlib,typing,collections,re,datetime","","","high",8,1
"/Users/steven/pythons/alphabet-html-gall.py","Web Development & Server Management","A script that generates an HTML gallery from a folder of images and videos, grouped alphabetically.","os","","","low",1,0
"/Users/steven/pythons/analyze_70_directories.py","Code & Project Analysis","A script to analyze a set of 70 directories, providing statistics and recommendations for merging and organizing them.","pathlib,collections,json","","","low",2,0
"/Users/steven/pythons/analyze_avatararts.py","Code & Project Analysis","A script for analyzing the `~/AVATARARTS` directory, generating a CSV of file metadata and a text report with a reorganization plan.","pathlib,datetime,collections,csv,json","","","medium",0,0
"/Users/steven/pythons/analyze_csv_insights.py","Data Processing & Manipulation","A script that analyzes the CSV output of another analysis tool to generate higher-level insights and recommendations.","csv,json,pathlib,collections,typing,re","","","medium",5,0
"/Users/steven/pythons/analyze_etsy_zips.py","Business & E-commerce","A script that analyzes Etsy-related zip files to check if their contents have been extracted, likely to manage product assets.","os,zipfile,pathlib","Etsy","","low",2,0
"/Users/steven/pythons/analyze_merge_candidates.py","File & Directory Management","A script to identify which directories can be safely merged based on size, naming, and content.","pathlib,collections,json","","","medium",2,0
"/Users/steven/pythons/analyze-mp3-transcript-prompts.py","AI & Machine Learning","A script that uses OpenAI's Whisper to transcribe audio files and then uses GPT to analyze the transcripts.","logging,os,openai,tqdm,csv,dotenv","OpenAI","Whisper,tqdm","medium",4,0
"/Users/steven/pythons/analyze.py","AI & Machine Learning","A script that uses OpenAI's GPT to analyze a song transcript for themes, emotions, and visual styles, likely for generating images or other creative content.","openai,os,dotenv","OpenAI","","low",2,0
"/Users/steven/pythons/apis/adapter.py","Web Development & Server Management","A custom HTTP adapter with caching capabilities, designed to work with the `requests` library and including async support.","asyncio,aiohttp,functools,logging,types,zlib,abc,dataclasses,pip._vendor.cachecontrol,pip._vendor.requests,pip._vendor.urllib3,typing","","aiohttp","high",11,6
"/Users/steven/pythons/apis/advanced_batch_volume_analyzer.py","Code & Project Analysis","A powerful script for analyzing large volumes of files, particularly Python scripts. It uses an `AdvancedPythonAnalyzer` to extract rich metadata from code.","pathlib,os,json,ast,sys,datetime,typing,collections,dotenv,PIL","OpenAI,Anthropic,Google,Groq,XAI,Perplexity,Cohere,Deepseek,Mistral,Together,Cerebras,OpenRouter,HuggingFace,Replicate,Stability,ElevenLabs,Suno,Make,n8n","Pillow,Selenium,Requests,BeautifulSoup,Pandas,NumPy,FFMPEG","high",10,3
"/Users/steven/pythons/apis/advanced_content_analyzer(1).py","Code & Project Analysis","Duplicate of ADVANCED_CONTENT_AWARE_ANALYZER.py.","os,sys,json,ast,hashlib,mimetypes,re,csv,pathlib,typing,dataclasses,datetime,collections,chardet,traceback","","AST,Chardet","high",22,6
"/Users/steven/pythons/apis/advanced_content_analyzer(2).py","Code & Project Analysis","Duplicate of ADVANCED_CONTENT_AWARE_ANALYZER.py.","os,sys,json,ast,hashlib,mimetypes,re,csv,pathlib,typing,dataclasses,datetime,collections,chardet,traceback","","AST,Chardet","high",22,6
/Users/steven/pythons/apis/content-aware-organizer.py,Code & Project Analysis,Analyzes folder structures and categorizes them based on content.,"pathlib, collections, logging",,,medium,3,1
/Users/steven/pythons/apis/context7_api_client.py,APIs & Web Scraping,A client for the Context7 REST API.,"os, json, pathlib, typing, datetime, urllib, ssl, dotenv",Context7,dotenv,high,8,2
/Users/steven/pythons/apis/context7_codebase_indexer.py,Code & Project Analysis,An indexer for a codebase to be used with Context7.,"os, ast, json, re, pathlib, typing, collections, datetime, dotenv",Context7,dotenv,high,11,2
/Users/steven/pythons/apis/cover.py,AI & Machine Learning,Generates cover images for audio files using DALL-E.,"openai, logging, glob, os, io, requests, moviepy, PIL",OpenAI,"moviepy, Pillow",medium,3,0
/Users/steven/pythons/apis/create_code_browser.py,Web Development & Server Management,Generates a visual code browser from python scripts.,"asyncio, aiohttp, functools, abc, dataclasses, html, datetime, functools, pathlib, typing, asyncio, base64, json, logging, os, re",,,high,25,4
/Users/steven/pythons/apis/createimages.py,AI & Machine Learning,"Generates images and associated content (titles, descriptions, tags) using OpenAI and Stability.ai.","os, openai, dotenv, logging, pathlib, io, pandas, requests, PIL, tqdm","OpenAI, StabilityAI","pandas, Pillow, tqdm",high,7,0
/Users/steven/pythons/apis/dalle-image-downloader.py,APIs & Web Scraping,Downloads images from URLs in a CSV file.,"os, pandas, requests, logging",,pandas,low,2,0
/Users/steven/pythons/apis/dalle-prompt.py,AI & Machine Learning,"Generates YouTube content based on an image description and URL, and also upscales images.","pathlib, csv, io, requests, openai, PIL, os, dotenv, logging",OpenAI,Pillow,medium,4,0
/Users/steven/pythons/apis/database.py,Data Science & Database,A MySQL database helper for a TikTok clip application.,"datetime, functools, mysql.connector, asyncio, logging, mysql.connector, pickle, settings, typing","MySQL, TikTok",mysql-connector-python,high,30,4
/Users/steven/pythons/apis/deep_functionality_analysis.py,Code & Project Analysis,Performs a deep recursive analysis of all folders in `~/pythons`.,"sys, ast, pathlib, collections, csv",,,high,2,0
/Users/steven/pythons/apis/deep_multi_volume_analyzer.py,Code & Project Analysis,Analyzes multiple volumes with deep content awareness.,"os, json, ast, re, pathlib, datetime, typing, collections, mimetypes, PIL, subprocess",,Pillow,high,11,2
/Users/steven/pythons/apis/DEEP_SCAN_ALL_CONTENT.py,Code & Project Analysis,A comprehensive scanner for the entire Python ecosystem.,"ast, re, pathlib, datetime, csv, hashlib, collections",,,high,5,0
/Users/steven/pythons/apis/analyze_for_miniforge_mamba.py,Code & Project Analysis,Analyzes Python projects for Miniforge/Mamba setup.,"re, pathlib, collections",,,medium,2,0
/Users/steven/pythons/apis/analyze_tsv.py,Data Science & Database,Analyzes a TSV backup file to extract insights and patterns.,"sys, collections, urllib.parse, pathlib, datetime",,,medium,5,0
/Users/steven/pythons/apis/analyze-all-scripts.py,Code & Project Analysis,A comprehensive script analyzer that outputs to a CSV file for batch renaming.,"os, re, ast, csv, pathlib, datetime",,,high,6,0
/Users/steven/pythons/apis/animation.py,GUI & Visualization,Contains functions for creating loading animations in the console.,"asyncio, functools, logging, os, sys, time",,,low,4,0
/Users/steven/pythons/apis/api_clients_api-key-inventory-v2.py,APIs & Web Scraping,Scans for API keys in `.env` files and creates an inventory.,"os, pathlib, csv, datetime, collections, typing",,python-dotenv,medium,6,0
/Users/steven/pythons/apis/api_clients_api-key-inventory.py,APIs & Web Scraping,Another script for API key inventory.,"os, pathlib, csv, datetime, collections, typing",,python-dotenv,medium,6,0
/Users/steven/pythons/apis/api_clients_client-v1.py,Video Processing,"A client for a video editing service, with functionality for downloading and uploading clips.","pathlib, ftplib, sys, traceback, clientUI, requests, scriptwrapper, settings, time, multiprocessing",,requests,high,9,0
/Users/steven/pythons/apis/api_clients_context7_api_client.py,APIs & Web Scraping,A client for the Context7 REST API.,"os, json, pathlib, typing, datetime, urllib, ssl, dotenv",Context7,python-dotenv,high,4,1
/Users/steven/pythons/apis/api_clients_database-clients-extract.py,Data Science & Database,Extracts conversation data from a SQLite database and generates HTML and Markdown archives.,"json, sqlite3, time, datetime, pathlib, base64",,,high,8,0
/Users/steven/pythons/apis/api_clients_firebase-api-processor.py,Social Media & Marketing,"A bot for reporting Instagram profiles and videos, using Firebase for data storage.","pathlib, os, time, webbrowser, multiprocessing, sys, firebase_admin, requests, colorama, dotenv, help, libs","Instagram, Firebase","firebase-admin, requests, colorama, python-dotenv",high,10,0
/Users/steven/pythons/apis/api_clients_goapi-midjourney-imagine.py,AI & Machine Learning,Uses the GoAPI to generate images with Midjourney.,"requests, os, dotenv, logging","Midjourney, GoAPI","requests, python-dotenv",low,0,0
/Users/steven/pythons/apis/cleanup.py,File Management & Organization,Cleans up temporary assets in assets/temp.,"os.path, os, shutil",,,low,2,0
/Users/steven/pythons/apis/client-v1.py,Video Processing,A client for a video editing service with functionality for downloading and uploading clips.,"pathlib, ftplib, sys, traceback, clientUI, requests, scriptwrapper, settings, time",,requests,high,9,0
/Users/steven/pythons/apis/cloud-services-aws-streamlit.py,Web Development & Server Management,"Entrypoint for Streamlit, integrating with various AI APIs for computer control.","pathlib, asyncio, base64, os, subprocess, traceback, contextlib, dataclasses, datetime, enum, functools, httpx, streamlit, anthropic","Streamlit, Anthropic, AWS, Vertex","streamlit, httpx, anthropic",high,11,2
/Users/steven/pythons/apis/code_intelligence_engine.py,AI & Machine Learning,"An advanced code intelligence system for AI Voice Agents, performing AST-based deep code understanding, semantic pattern recognition, and intelligent content categorization.","ast, json, hashlib, numpy, pathlib, typing, dataclasses, datetime, collections, spacy, sklearn, networkx",,numpy,high,6,2
/Users/steven/pythons/apis/collect_stats.py,Social Media & Marketing,Collects information about an Instagram account every hour and saves it to a TSV file.,"instabot, typing, argparse, asyncio, logging, os, sys, time",Instagram,instabot,medium,6,0
/Users/steven/pythons/apis/comment_medias_by_location.py,Social Media & Marketing,Comments on Instagram media by location.,"instabot, typing, argparse, asyncio, codecs, logging, os, sys, tqdm",Instagram,"instabot, tqdm",medium,6,0
/Users/steven/pythons/apis/compat.py,Testing & Utilities,Contains compatibility functions and checks for different Python versions and platforms.,"asyncio, logging, os, sys, typing",,,low,2,0
/Users/steven/pythons/apis/comprehensive-dedup-rename.py,File Management & Organization,A comprehensive deduplication and rename tool that identifies similar files and suggests renaming them based on content.,"difflib, json, pathlib, collections",,,medium,4,0
/Users/steven/pythons/apis/comprehensive-rename-cleaner.py,File Management & Organization,"Re-analyzes files, identifies third-party code, and provides accurate renames.","csv, re, ast, pathlib, datetime",,,high,5,0
/Users/steven/pythons/apis/conf.py,Documentation,Configuration settings for Sphinx documentation.,"typing, html, asyncio, logging",,,low,1,0
/Users/steven/pythons/apis/content_based_duplicate_analyzer.py,Code & Project Analysis,"Analyzes file content, functionality, and usage patterns to find true duplicates, ignoring misleading filenames.","csv, ast, re, collections, typing, hashlib, difflib",,,high,6,0
/Users/steven/pythons/apis/content_based_migration.py,File Management & Organization,"Reorganizes files based on deep content analysis rather than filename patterns, creating a new content-based directory structure.","collections, functools, pathlib, typing, asyncio, json, logging, os, re, shutil",,,high,11,2
/Users/steven/pythons/apis/deep-code.py,AI & Machine Learning,"Performs AI-powered deep intelligent content-aware analysis with duplicate detection, semantic understanding, and architectural pattern recognition.","ast, difflib, hashlib, json, os, re, collections, datetime, pathlib, typing, openai, google.generativeai, anthropic","OpenAI, Google, Anthropic",,high,11,2
/Users/steven/pythons/apis/deepgram-test.py,APIs & Web Scraping,Tests the Deepgram API for live transcription.,"deepgram, httpx, threading, os, dotenv, logging",Deepgram,"httpx, python-dotenv",low,2,0
/Users/steven/pythons/apis/deepgram-updated.py,APIs & Web Scraping,"An updated Deepgram live transcription test script, compatible with SDK v3+.","pathlib, os, deepgram, logging",Deepgram,,low,2,0
/Users/steven/pythons/apis/delete_sagemaker_endpoint.py,Web Development & Server Management,Deletes an AWS SageMaker endpoint and its associated configuration.,"boto3, typing, asyncio, llm_engineering.settings, loguru","AWS, SageMaker","boto3, loguru",medium,4,0
/Users/steven/pythons/apis/diagnose.py,Testing & Utilities,"Provides diagnostic functions for Beautiful Soup, including a diagnostic suite for common problems and a performance benchmark.","pathlib, cProfile, pstats, random, sys, tempfile, time, traceback, html.parser, io, bs4, bs4.builder",,"beautifulsoup4, lxml",high,7,0
/Users/steven/pythons/apis/direct.py,Social Media & Marketing,"Contains functions for sending various types of messages (text, media, hashtag, profile, like, photo) via Instagram Direct.","os, mimetypes, tqdm",Instagram,tqdm,medium,3,0
/Users/steven/pythons/apis/dispatch.py,Web Development & Server Management,A Requests hooks system for dispatching hook dictionaries on response data.,,,,low,2,0
/Users/steven/pythons/apis/extract-archived-content.py,File Management & Organization,"Extracts and preserves valuable content from archived directories, including CSV, MD, and HTML files.","re, csv, shutil, pathlib, datetime, difflib, typing, bs4",,beautifulsoup4,high,8,0
/Users/steven/pythons/apis/fetch_file_from_file-organizer.py,APIs & Web Scraping,Downloads all generated images and their metadata from Leonardo.ai.,"json, requests, os, shutil, time, gzip, tqdm",Leonardo.ai,tqdm,medium,3,0
/Users/steven/pythons/apis/ffmpeg-downloader.py,Video Processing,Downloads and installs FFmpeg for various operating systems.,"os, pathlib, shutil, sys, uuid, urllib.request",,,medium,3,0
/Users/steven/pythons/apis/ffmpeg-installer.py,Video Processing,Installs FFmpeg based on the operating system.,"os, subprocess, zipfile, requests",,requests,medium,3,0
/Users/steven/pythons/apis/filewrapper.py,Testing & Utilities,"A small wrapper around a file pointer object, designed to buffer read data and execute a callback when the file is closed.","asyncio, logging, mmap, typing, http.client, html, functools, tempfile",,,low,2,0
/Users/steven/pythons/apis/final_root_cleanup.py,File Management & Organization,Organizes remaining loose items in the root directory into a context-fluid structure.,"shutil, collections, pathlib",,,medium,3,0
/Users/steven/pythons/apis/find_script.py,Code & Project Analysis,Helps locate Python scripts in an organized structure and provides an interactive search mode.,"collections, functools, pathlib, typing, asyncio, logging, os, re, html",,,high,10,0
/Users/steven/pythons/apis/firebase-api-processor.py,Social Media & Marketing,"A bot for reporting Instagram profiles and videos, using Firebase for data storage.","pathlib, os, time, webbrowser, multiprocessing, sys, firebase_admin, requests, colorama, dotenv, help, libs","Instagram, Firebase","firebase-admin, requests, colorama, python-dotenv",high,10,0
/Users/steven/pythons/apis/fix-bare-except-statements.py,Code & Project Analysis,"Automatically detects and fixes bare `except` clauses in Python code, suggesting intelligent exception types based on context.","ast, pathlib, datetime, collections, typing, logging",,,high,5,0
/Users/steven/pythons/apis/fluid-document-sweep.py,Code & Project Analysis,Analyzes the `~/Documents` directory to identify valuable Python scripts and utilities for a reference repository.,"os, json, pathlib, datetime, dataclasses, typing, re, logging",,,high,6,0
/Users/steven/pythons/apis/follow_requests.py,Social Media & Marketing,Approves or rejects pending Instagram follow requests.,"instabot, typing, argparse, logging, os, sys",Instagram,instabot,low,1,0
/Users/steven/pythons/apis/follow_unfollow_and_send_telegram_msg.py,Social Media & Marketing,Uses Instapy to follow/unfollow users and send Telegram notifications.,"datetime, functools, instapy, typing, asyncio, logging, requests, schedule, time, traceback","Instagram, Telegram","instapy, requests, schedule",high,6,0
/Users/steven/pythons/apis/formdata.py,Web Development & Server Management,Helps generate form data for `multipart/form-data` and `application/x-www-form-urlencoded` encodings.,"io, typing, urllib.parse, multidict, multipart, payload",,,low,2,0
/Users/steven/pythons/apis/from_link.py,Social Media & Marketing,Takes a Reddit post link and returns the top 5 comments from the post.,"typing, argparse, asyncio, config, logging, praw, sys",Reddit,praw,low,1,0
/Users/steven/pythons/apis/FUNCTIONAL_DUPLICATE_SCANNER.py,Code & Project Analysis,"Finds files that perform the same function, even if their code is different.","ast, pathlib, collections, shutil, datetime",,,medium,5,0
/Users/steven/pythons/apis/gallery-url-parser.py,Image Processing,"Parses photo links from OneDrive, extracts base URLs and photo names, and creates thumbnails.","time, pkg_resources, simplegallery.common, simplegallery.media, selenium, simplegallery.logic.base_gallery_logic",OneDrive,selenium,medium,4,0
/Users/steven/pythons/apis/gemini-storybook-audio.py,AI & Machine Learning,"Downloads assets and metadata from public Gemini ""storybook"" share links, rendering pages with Playwright.","argparse, asyncio, csv, hashlib, json, re, sys, time, urllib.parse, dataclasses, pathlib, playwright",Google Gemini,playwright,high,6,0
/Users/steven/pythons/apis/generate-emotional-audio.py,AI & Machine Learning,An AlchemyAPI Creative TTS Generator that creates diverse MP3 sets using GPT TTS with creative emotional and content variations.,"pathlib, os, sys, json, random, datetime, dotenv, pydub, requests, logging",OpenAI,"pydub, python-dotenv",high,6,0
/Users/steven/pythons/apis/get_hashtags_from_keywords.py,Social Media & Marketing,Takes keywords and generates related Instagram hashtags.,"itertools, functools, instabot, typing, asyncio, logging, os, sys",Instagram,instabot,low,2,0
/Users/steven/pythons/apis/giphy-gifs.py,Image Processing,Downloads GIFs from Giphy based on search terms.,"json, sys, time, pathlib, requests",Giphy,requests,low,0,0
/Users/steven/pythons/apis/git_downloader.py,Testing & Utilities,"Downloads files from a GitHub repository, clones the repository, and compares local file hashes with remote ones.","functools, git, typing, asyncio, hashlib, logging, os, requests",GitHub,"GitPython, requests",medium,4,0
/Users/steven/pythons/apis/github-repo-audit.py,Code & Project Analysis,"Scans all GitHub repos for a user, scores their usefulness, and outputs CSV/JSON/HTML reports.","argparse, csv, json, os, shutil, subprocess, sys, time, datetime, pathlib, requests, dotenv",GitHub,"requests, python-dotenv",high,6,0
/Users/steven/pythons/apis/google_url_scrapper.py,APIs & Web Scraping,Scrapes Google search results for URLs and can fetch SEO metrics using MajesticSEO API.,"functools, typing, asyncio, datetime, logging, os, random, requests, sys, time, xgoogle.search","Google, MajesticSEO",requests,medium,4,0
/Users/steven/pythons/apis/group_by_functionality.py,Code & Project Analysis,"Groups files by functionality based on imports, functions, code patterns, and purpose.","sys, ast, pathlib, collections",,,medium,4,0
/Users/steven/pythons/apis/GTTS.py,AI & Machine Learning,Generates speech from text using Google Text-to-Speech (gTTS).,"functools, gtts, utils, asyncio, secrets, typing",Google,gtts,medium,3,0
/Users/steven/pythons/apis/instagram-requirements.py,Utility & Dependency Management,Intelligent Requirements Generator; analyzes Python files to extract and generate requirements.txt.,"ast, pathlib, collections, typing, json",Python,,high,10,0
/Users/steven/pythons/apis/instagram-social-platforms-instagram-scraper.py,Social Media & Marketing,"Instagram scraper for followers, following, login, posts, comments, DMs, and reporting profiles/videos.","instabot, datetime, time, logging, os, random, signal, sys, re, json, requests",Instagram,"instabot, requests",high,11,0
/Users/steven/pythons/apis/instagram-sort.py,File Management & Organization,"Final Intelligent Sort tool for categorizing items into AI_CONTENT, AUTOMATION_BOTS, MEDIA_PROCESSING, DATA_UTILITIES.","shutil, pathlib, collections",File System,,medium,3,0
/Users/steven/pythons/apis/instareport-libs-attack.py,Social Media & Marketing,"Reports Instagram profiles and videos; handles connection errors, cookie parsing, session management.","random, string, requests.Session, libs.user_agents, libs.utils",Instagram,requests,medium,5,0
/Users/steven/pythons/apis/INTELLIGENT_VERSION_ANALYZER.py,Code & Project Analysis,Deep content analysis with parent-folder awareness and function intelligence to compare Python file versions and generate recommendations.,"ast, re, pathlib, datetime, collections, csv, hashlib",Python,,high,7,0
/Users/steven/pythons/apis/intelligent-renamer-1.py,File Management & Organization,"AI-Powered Deep Analysis and Smart File Renaming System for content analysis, purpose detection, and intelligent naming.","ast, json, os, re, collections, datetime, pathlib, typing, openai, google.generativeai, anthropic",Python,"openai, google.generativeai, anthropic, dotenv, Pillow, requests",high,12,0
/Users/steven/pythons/apis/interact_DM.py,Social Media & Marketing,"Reads and replies to Instagram direct messages, including login, inbox fetching, and interactive responses.","instabot, argparse, asyncio, logging, os, sys, typing, functools",Instagram,instabot,medium,8,0
/Users/steven/pythons/apis/labels.py,Utility & Data Encoding,"Defines a mapping of encoding labels to their names, automatically generated by mklabels.py.",,Web Encoding,,low,0,0
/Users/steven/pythons/apis/lazy_wheel.py,Package Management & Network Optimization,Provides lazy loading for ZIP files over HTTP using HTTP range requests for efficient metadata retrieval from wheel files.,"bisect, contextlib, functools, pip._internal.metadata, pip._internal.network.session, pip._internal.network.utils, pip._vendor.packaging.utils, pip._vendor.requests.models, tempfile, typing, zipfile, asyncio, logging",Python Packaging,"pip, aiohttp",high,14,0
/Users/steven/pythons/apis/leonardo-api.py,AI & Image Processing,"Interacts with Leonardo.ai API for image upscaling, supporting JPEG conversion, uploads, and retrieving upscaled images.","json, requests, os, time, sys, PIL.Image",Leonardo.ai,"requests, Pillow",medium,6,0
/Users/steven/pythons/apis/leonardo-autonomous-content-agency.py,AI & Content Generation,"Autonomous Content Agency for self-improving content creation, trend analysis, multi-model ideation, A/B testing, and self-optimization.","os, json, time, asyncio, requests, openai, datetime, pathlib, typing, anthropic","Leonardo.AI, GPT-5, Claude, Perplexity, Mem0","requests, openai, anthropic",high,10,0
