"file_path","category","description","imports","apis_used","technologies","complexity","num_functions","num_classes"
/Users/steven/pythons/apis/semantic_content_analyzer.py,Content Analysis & Knowledge Management,"Semantic Content Analyzer for MD/HTML/PDF files; categorizes by topic, project, SEO value, and content type, extracts metadata, classifies content, identifies project associations, assesses quality, uses sentence-transformers, and generates reports.","argparse, csv, hashlib, json, os, re, collections, datetime, pathlib, typing, chardet, bs4, sentence_transformers, numpy, sklearn.cluster","sentence-transformers, scikit-learn","sentence-transformers, scikit-learn",high,14,0
/Users/steven/pythons/apis/send_text_from_file-organizer.py,Networking & HTTP Communication,"Internal module from the requests library, defining transport adapters for HTTP/HTTPS connections, handling pooling, proxies (SOCKS), SSL, and building Response objects from urllib3.","os.path, socket, typing, warnings, pip._vendor.urllib3.exceptions, pip._vendor.urllib3.poolmanager, pip._vendor.urllib3.util, pip._vendor.urllib3.util.retry, pip._vendor.urllib3.util.ssl_, auth, compat, cookies, exceptions, models, structures, utils, ssl","requests, urllib3",requests,high,16,0
/Users/steven/pythons/apis/serve_code_browser.py,Web Serving & Local Development,"Launches a local web server to serve a visual code browser locally, making directory content available via HTTP and opening it in a web browser.","asyncio, http.server, logging, os, socketserver, webbrowser, sys, typing, pathlib",Web Server,,medium,9,0
/Users/steven/pythons/apis/serve_docs.py,Web Serving & Documentation,"Launches a local web server to serve local HTML documentation, making Sphinx documentation accessible via a web browser.","asyncio, http.server, logging, os, socketserver, webbrowser, sys, typing, pathlib","Web Server, Sphinx",,medium,9,0
/Users/steven/pythons/apis/set_github_vars.py,CI/CD & Environment Management,"Extracts system and application information (OS, CPU architecture, app version) and writes them as environment variables to the GITHUB_ENV file for GitHub Actions workflows.","asyncio, logging, os, platform, subprocess, typing",GitHub Actions,,medium,6,0
/Users/steven/pythons/apis/settings.py,Configuration Management & Validation,"Validates and manages TOML configuration files, recursively crawling, checking values against types, regexes, and ranges, and prompting user for corrections.","asyncio, logging, os, re, toml, typing, rich.console, utils.console",TOML,,medium,8,0
/Users/steven/pythons/apis/setup_sphinx_docs_uv.py,Documentation Generation & Build,"Sets up Sphinx documentation: checks/installs dependencies (uv/pip), creates directory structure, initializes Sphinx, generates conf.py, index.rst, overview, category pages, API docs, tutorials, examples, and builds HTML docs.","asyncio, json, logging, os, subprocess, sys, typing, pathlib",Sphinx,"sphinx, sphinx-rtd-theme, sphinx-autodoc-typehints, myst-parser, sphinxcontrib-mermaid",high,11,0
/Users/steven/pythons/apis/setup_sphinx_docs.py,Documentation Generation & Build,"Sets up Sphinx documentation (similar to _uv.py): checks dependencies, creates directory structure, initializes Sphinx, generates configuration/documentation pages, and builds HTML docs.","asyncio, json, logging, os, subprocess, sys, typing, pathlib",Sphinx,"sphinx, sphinx-rtd-theme, sphinx-autodoc-typehints, myst-parser, sphinxcontrib-mermaid",high,11,0
/Users/steven/pythons/apis/setup-browser.py,Package Management & Project Setup,"setuptools setup file for a simple photo gallery project, defining metadata, dependencies (opencv-python, pillow, jinja2, selenium, requests), and console entry points.","setuptools, os",Python,"opencv-python, pillow, jinja2, selenium, requests",medium,2,0
/Users/steven/pythons/apis/setup.py,Package Management Boilerplate,"Minimal setuptools setup file including basic metadata like name, version, and find_packages() for Python package distribution.","setuptools, os",Python,,low,2,0
/Users/steven/pythons/apis/sheets.py,Data Management & Google Sheets API,"Google Sheets helpers using gspread; handles OAuth authentication, opens spreadsheets, ensures worksheets exist, sets headers, replaces rows, and appends unique rows by key.","os, typing, gspread, google.oauth2.service_account, google.oauth2.credentials, google.auth.transport.requests, google_auth_oauthlib.flow",Google Sheets,"gspread, google-auth-oauthlib",high,7,0
/Users/steven/pythons/apis/simple_docs_generator.py,Documentation Generation,"Generates a simple docs folder structure, creates index.html with TOC, and generates content pages from provided data.","typing, pathlib, os, re, json, markdown",Python,,medium,6,0
/Users/steven/pythons/apis/smart-conservative-renamer.py,File Management & Renaming,"Conservatively renames files based on rules, content analysis (AST for Python), and parent folder context. Identifies good/bad names, simplifies, cleans version numbers, generates undo scripts.","ast, csv, os, re, datetime, pathlib, logging, typing",Python,,high,8,0
/Users/steven/pythons/apis/smart-content-renamer-v3.py,File Management & Renaming,"Advanced content-aware file renamer (V3) using deep semantic analysis, AST parsing, pattern matching, AI-powered suggestions, duplicate detection, and dependency tracking.","ast, re, json, csv, pathlib, datetime, collections, typing, dataclasses, logging",Python,,high,11,0
/Users/steven/pythons/apis/smart-rename-versions.py,File Management & Version Control,Analyzes script purpose for different versions and renames them to a consistent format (original-v{N}-{purpose}.py) based on inferred content.,"json, pathlib, re",Python,,medium,3,0
/Users/steven/pythons/apis/snoopplugins.py,OSINT/Reconnaissance & Network Tools,"Collection of Snoop Project plugins for Yandex parser, Reverse Vgeocoder, and GEO_IP/domain analysis (IP lookup, domain resolution). Handles console I/O, formatting, network requests.","pathlib, ipaddress, json, locale, os, platform, re, random, requests, signal, socket, sys, threading, time, webbrowser, colorama, rich.console, rich.progress, rich.table, urllib.parse, snoopbanner",Python,"colorama, rich, requests, snoopbanner",high,18,0
/Users/steven/pythons/apis/social-platforms-instagram-bot-error.py,Social Media Automation,"Instagram bot for liking, commenting, viewing stories, and repeatedly commenting on 'draw' posts using Selenium for browser automation.","logging, os, platform, time, pyfiglet, selenium.webdriver, selenium.webdriver.common.keys","Selenium, Instagram API","selenium, pyfiglet",high,7,0
/Users/steven/pythons/apis/society6-upload.py,Web Automation & File Upload,Automates login and image upload to Society6.com using Selenium for browser control and pyautogui for file dialog interaction.,"time, pyautogui, selenium.webdriver","Selenium, PyAutoGUI","selenium, pyautogui",medium,3,0
/Users/steven/pythons/apis/sphinxext.py,Documentation Generation & Sphinx Extension,"Sphinx extension for generating automatic documentation of Pygments lexers, formatters, and filters, using AST parsing for information extraction.","asyncio, aiohttp, functools, abc, dataclasses, threading, pip._vendor.pygments.filters, pip._vendor.pygments.formatters, pip._vendor.pygments.lexers, docutils, sphinx.util.nodes, typing, logging, sys","Sphinx, Pygments","sphinx, docutils, aiohttp",high,16,0
/Users/steven/pythons/apis/splt.py,File Processing & HTML Manipulation,"Splits a large HTML file into smaller chunks using BeautifulSoup, either by specific tags or by a fixed character length.","pathlib, os, bs4, logging",BeautifulSoup,beautifulsoup4,medium,4,0
/Users/steven/pythons/apis/stability-format.py,Content Generation & Automation,"Format-Optimized Medium Article Automation tool. Analyzes Python folder, categorizes files, generates SEO-optimized HTML articles, JSON data, and CSV metrics.","json, csv, re, pathlib, datetime, collections, subprocess, logging","Python, SEO",,high,8,0
/Users/steven/pythons/apis/adapter.py,Networking & Caching,"Extends HTTPAdapter to provide caching functionality for HTTP requests using CacheControl, managing cache, ETag validation, and permanent redirects.","pip._vendor.cachecontrol.cache, pip._vendor.cachecontrol.heuristics, pip._vendor.cachecontrol.serialize, pip._vendor.requests, pip._vendor.urllib3, pip._vendor.cachecontrol.controller, pip._vendor.filewrapper, pip._vendor.requests.adapters, typing, asyncio, functools, logging, types, zlib","requests, CacheControl",cachecontrol,high,11,0
/Users/steven/pythons/apis/advanced_batch_volume_analyzer.py,Code Analysis & Project Intelligence,"Performs deep content-aware analysis of Python files using AST parsing, API usage detection, technology identification, and purpose inference. Collects statistics on file types and sizes.","pathlib, os, json, ast, sys, datetime, typing, collections, dotenv, advanced_toolkit.file_intelligence, advanced_toolkit.config_manager, PIL","Python, AST, OpenAI, Anthropic, Google, Groq, XAI, Perplexity, Cohere, DeepSeek, Mistral, Together, Cerebras, OpenRouter, HuggingFace, Replicate, Stability, ElevenLabs, Suno, Make, N8n, Selenium, Requests, BeautifulSoup, Pandas, Numpy, Pillow, Ffmpeg","dotenv, advanced_toolkit, Pillow",high,11,0
/Users/steven/pythons/apis/advanced_content_analyzer(1).py,Static Code Analysis & Quality Improvement,"Content-aware analyser for Python projects using AST to extract metrics, detect design patterns, infer domains, and compute confidence scores. Generates suggestions for improvement.","__future__, ast, os, json, typing","Python, AST",,high,5,0
/Users/steven/pythons/apis/advanced_content_analyzer(2).py,Static Code Analysis & Quality Improvement,"Content-aware analyser for Python projects using AST to extract metrics, detect design patterns, infer domains, and compute confidence scores. Generates suggestions for improvement. (Duplicate of previous entry)","__future__, ast, os, json, typing","Python, AST",,high,5,0
/Users/steven/pythons/apis/advanced_quality_enhancer.py,Code Refactoring & Quality Improvement,"Applies enterprise-grade patterns, design patterns (singleton, factory, observer), performance optimizations (caching, async), security hardening (input validation, sanitization), and architectural improvements.","os, sys, ast, re, logging, json, shutil, pathlib, typing, dataclasses, datetime, argparse, tempfile, hashlib, threading, concurrent.futures, time, asyncio, aiohttp, functools, abc","Python, Design Patterns, Security",,high,16,0
/Users/steven/pythons/apis/advanced_quality_improver.py,Code Refactoring & Quality Improvement,"Implements quality improvements focusing on complexity reduction, performance, security, error handling, memory optimization, concurrency, and design patterns. Calculates quality scores and generates reports.","os, sys, ast, re, logging, json, shutil, pathlib, typing, dataclasses, datetime, argparse, subprocess, tempfile, asyncio, aiohttp, functools, abc, requests, urllib3.util.retry","Python, Design Patterns, Security","requests, urllib3",high,17,0
/Users/steven/pythons/apis/advanced-script-finder.py,Code Discovery & Analysis,"Scans Python files for advanced patterns (async/await, type hints, dataclass), API usage, and best practices. Scores scripts and generates a report with improvement suggestions.","os, pathlib, ast, re, json, collections, datetime, dotenv","Python, AST, OpenAI, Anthropic, Gemini, Groq, HuggingFace, ElevenLabs, PIL/Pillow, FastAPI, Streamlit, Requests, AsyncIO, SQLite, Pandas",dotenv,high,8,0
/Users/steven/pythons/apis/ai-deep-analyzer.py,AI-driven Code Analysis,"Orchestrates AI-powered semantic analysis (OpenAI, Gemini, Anthropic), AST parsing, vector embeddings, and architectural pattern detection for comprehensive Python code insights.","ast, json, os, collections, datetime, pathlib, typing, logging, dotenv, openai, google.generativeai, anthropic, numpy","Python, AI, AST, OpenAI, Gemini, Anthropic, Numpy","dotenv, openai, google.generativeai, anthropic, numpy",high,12,0
/Users/steven/pythons/apis/ai-stability-code.py,Intelligent Code Analysis,"Performs adaptive content-aware analysis, detecting language, frameworks, and purpose. Calculates code metrics, complexity scores, and generates insights on security, quality, performance, style, and documentation.","json, re, pathlib, collections, datetime, typing, dataclasses, logging",Python,,high,7,0
/Users/steven/pythons/apis/alchemy-quiz.py,Audio Generation & Data Processing,"Automatically generates MP3 audio files from quiz data (CSV) using OpenAI's TTS API, constructing speech text, handling generation, and padding audio.","pathlib, os, sys, dotenv, pydub, requests, csv, logging","OpenAI TTS, CSV, Audio","dotenv, pydub, requests",high,7,0
/Users/steven/pythons/apis/analyze_for_miniforge_mamba.py,Dependency Management & Environment Setup,Analyzes Python projects for import statements to generate Conda/Mamba environment.yml files. Identifies third-party dependencies and creates individual and combined environment files along with a markdown report.,"re, pathlib, collections, dotenv","Python, Conda, Mamba",dotenv,high,4,0
/Users/steven/pythons/apis/analyze_tsv.py,Data Analysis & Reporting,"Analyzes TSV backup files to extract insights and patterns from URL data, timestamps, and titles. Generates reports on time analysis, domain analysis, category analysis, file type, and most visited URLs.","sys, collections, urllib.parse, pathlib, datetime",Python,,medium,5,0
/Users/steven/pythons/apis/analyze-all-scripts.py,"Code Analysis, Categorization & File Management","Performs comprehensive analysis of Python files: extracts docstrings, detects APIs, categorizes scripts, suggests renames, and identifies files for deletion. Outputs a detailed CSV report.","os, pathlib, re, ast, csv, datetime, dotenv","Python, AST",dotenv,high,7,0
/Users/steven/pythons/apis/analyze-folder-reader.py,Documentation Generation & Code Analysis,"Comprehensive CLI tool (pyrepo_doc_organizer.py) to audit Python repositories using AST to summarize modules, functions, classes, and imports. Generates Markdown summaries, CSV index, and optional HTML index.","os, pathlib, re, ast, csv, html, json, typing, dotenv, openai","Python, AST, OpenAI","dotenv, openai",high,10,0
/Users/steven/pythons/apis/animation.py,Console Animation & UI Utility,"Animated console application startup sequence using ASCII art and progress indicators. Includes functions for text coloring. Imports pyautogui and selenium.webdriver, but their explicit use for animation isn't clear.","time, pyautogui, selenium.webdriver, sys, os, logging, functools, asyncio, aiohttp, abc, dataclasses, threading",Python,"pyautogui, selenium",medium,11,0
/Users/steven/pythons/apis/api_clients_api-key-inventory-v2.py,Security & Credential Management,"Scans .env files, identifies API keys, categorizes them by service, and determines their status (active, placeholder, not set) without exposing actual values. Checks for specific missing important keys and generates a CSV report.","os, pathlib, csv, datetime, collections, typing, dotenv",Python,dotenv,high,7,0
/Users/steven/pythons/apis/api_clients_api-key-inventory.py,Security & Credential Management,"Scans .env files, identifies API keys, categorizes them, and checks for missing common APIs. Generates a CSV report with status and preview information. (Likely an earlier version or alternative to v2).","os, pathlib, csv, datetime, collections, typing, dotenv",Python,dotenv,high,7,0
/Users/steven/pythons/apis/api_clients_client-v1.py,Video Processing Client & Networking Utility,"Client for a video processing and generation service. Handles requests for video clips, downloads them via FTP, uploads files, and updates render status. Interacts with custom UI, wrapper, and settings modules.","pathlib, ftplib, sys, traceback, clientUI, requests, scriptwrapper, settings, logging, time","Python, FTP, Requests","clientUI, scriptwrapper, settings, requests",high,10,0
/Users/steven/pythons/apis/api_clients_context7_api_client.py,API Client & Documentation Integration,"Context7 REST API Client provides programmatic access to the Context7 library documentation API. Allows searching for libraries, getting snippets, and integrating with codebase to fetch relevant docs and generate a markdown summary.","os, json, pathlib, typing, datetime, urllib.request, urllib.parse, urllib.error, ssl, dotenv","Python, Context7 API",dotenv,high,11,0
/Users/steven/pythons/apis/api_clients_database-clients-extract.py,Data Management & Conversation Archiving,"Automated Conversation Archive System. Initializes SQLite DB, extracts conversations from Cursor's chat DB, loads prompt history, creates conversation entries from prompts, and generates HTML and Markdown archives.","json, sqlite3, time, datetime, pathlib, logging","Python, SQLite",,high,6,0
/Users/steven/pythons/apis/api_clients_firebase-api-processor.py,Social Media Botting & Firebase Integration,"Initializes Firebase app, handles profile/video attack processes (social media reporting/botting), features an unlock mechanism. Interacts with custom libs for animation, attack, modules, logo, proxy, and utils.","pathlib, os, time, webbrowser, multiprocessing, firebase_admin, requests, colorama, dotenv, firebase_admin.credentials, firebase_admin.db, firebase_admin.firestore","Firebase, Social Media Bot, Multiprocessing","dotenv, firebase_admin, requests, colorama, about, help, libs.animation, libs.attack, libs.check_modules, libs.logo, libs.proxy_harvester, libs.utils",high,11,0
/Users/steven/pythons/apis/api_clients_goapi-midjourney-imagine.py,AI Image Generation & Processing Client,"Uses GoAPI.ai Midjourney imagine API to generate images. Loads API key, sends prompts, converts images to JPEG, and processes images for upload and upscaling.","pathlib, os, json, requests, time, sys, PIL.Image, logging, dotenv","GoAPI.ai, Midjourney, AI Image Generation, PIL","dotenv, requests, Pillow",high,8,0
/Users/steven/pythons/apis/api_clients_instabot-api-prepare.py,Credential Management for Instagram Automation,"Prepares credentials for an Instagram bot by managing a 'secret.txt' file. Functions to add, get, and delete Instagram login and password securely using getpass.","pathlib, getpass, os, sys, logging","Instagram API, Credential Management",,medium,4,0
/Users/steven/pythons/apis/api_clients_leonardo-api.py,AI Image Generation & Manipulation Client,"Interacts with the Leonardo.ai API for image generation and manipulation. Handles authentication, JPEG conversion, presigned URLs, image uploads, upscaling, and retrieving upscaled images. Processes images in a directory, applying styles.","pathlib, os, json, requests, time, sys, PIL.Image, logging, dotenv","Leonardo.ai, AI Image Generation, PIL","dotenv, requests, Pillow",high,8,0
/Users/steven/pythons/apis/api_clients_parse-api.py,"Audio Processing, Transcription & AI Content Analysis","OpenAI Whisper and GPT API client for audio transcription and analysis. Processes MP3 files, transcribes with Whisper, analyzes transcripts with GPT-3.5-turbo (themes, emotional tone, metaphors), and links timestamps.","pathlib, logging, os, sys, time, concurrent.futures, dotenv, openai, termcolor, tqdm","OpenAI Whisper, GPT, Audio Transcription, AI Content Analysis","dotenv, openai, termcolor, tqdm",high,10,0
/Users/steven/pythons/apis/api_clients_scraping-download-intelligent.py,File Management & Renaming,"Intelligent Content-Aware File Renamer. Analyzes file content (AST parsing, imports, functions, classes, docstrings, keywords) to suggest better, more descriptive filenames. Identifies badly named files, proposes new names, and can apply renames (optionally with git).","pathlib, os, re, ast, json, subprocess, typing, collections, logging, dotenv","Python, AST, Git",dotenv,high,10,0
/Users/steven/pythons/apis/api_clients_scraping-download-news-api-fetcher.py,AI Content Generation & Management,"News API client for content creation. Uploads files (internal links, products, content plan CSV) to OpenAI, creates an assistant to generate blog outlines and articles, and processes a content plan CSV by generating outlines and articles for blog post ideas.","pathlib, os, csv, time, openai, tqdm, dotenv","OpenAI, News API, AI Content Generation","dotenv, openai, tqdm",high,7,0
/Users/steven/pythons/apis/api_clients_upload-api.py,Image Processing & Optimization,"AI-Powered Image Processor. Processes images in a directory, optimizing file size (JPEG conversion, quality reduction) or upscaling smaller images, based on size thresholds. Extracts metadata and logs processing status to a CSV file.","csv, os, time, datetime, PIL.Image, PIL.UnidentifiedImageError, tqdm, logging","PIL, Image Processing","Pillow, tqdm",high,7,0
/Users/steven/pythons/apis/api_clients_youtube-authentication.py,API Authentication Utility,"Tests OAuth authentication with YouTube. Uses google_auth_oauthlib.flow.InstalledAppFlow to handle credentials for YouTube API access, specifically for upload scopes.","google_auth_oauthlib.flow, logging","YouTube API, OAuth",google_auth_oauthlib,medium,2,0
/Users/steven/pythons/apis/api_clients_youtube-request.py,Twitch API Client,"Simple client for the Twitch API. Provides functions to make requests to Twitch endpoints (e.g., helix/clips), including data (for specific clips), helix (for users or other categories), and top_clips. Handles OAuth tokens and client IDs.","requests, logging",Twitch API,requests,medium,2,0
/Users/steven/pythons/apis/APIHandler.py,API Client (YouTube & Twitch),"Defines APIHandler class for YouTube and Twitch API interactions. Methods to get YouTube playlist size, obtain new Twitch tokens, and get Twitch game IDs. Uses requests, aiohttp, and urllib3.","asyncio, aiohttp, functools, logging, requests, requests.adapters, urllib3.util.retry, abc, dataclasses, config, src.utils","YouTube API, Twitch API, aiohttp","aiohttp, requests, urllib3",high,10,0
/Users/steven/pythons/apis/approve_thread_requests.py,Social Media Automation (Instagram),"Uses instabot library to approve pending thread requests on Instagram. Includes basic argparse setup for username, password, and proxy.","instabot, logging, os, sys, typing, argparse, asyncio, functools","Instagram API, instabot",instabot,medium,5,0
/Users/steven/pythons/apis/archive_medias.py,Social Media Automation (Instagram),"Uses instabot library to archive media files on Instagram. Iterates through media IDs and archives them. Includes argparse setup for username, password, and proxy, and uses tqdm for progress indication.","instabot, logging, os, sys, typing, argparse, asyncio, functools, tqdm","Instagram API, instabot, tqdm","instabot, tqdm",medium,5,0
/Users/steven/pythons/apis/archive-reader.py,"File Management, Consolidation & Deduplication","Comprehensive Merge and Consolidation Tool. Merges Python directories and files from multiple sources into a unified, organized structure. Detects duplicates, analyzes file content for quality/category, and generates a merge report.","os, logging, shutil, hashlib, json, zipfile, pathlib, typing, collections, re, datetime",Python,,high,11,0
/Users/steven/pythons/apis/art.py,Decorative/UI Utility,Uses pyfiglet to render ASCII art (specifically 'Instagram bot'). Includes async functions (artName) for displaying the art with a delay.,"asyncio, pyfiglet, time, typing, logging",Pyfiglet,pyfiglet,low,5,0
/Users/steven/pythons/apis/ask-reddit.py,"Content Creation, Social Media Automation & Video Processing","Reddit video generator. Scrapes 'AskReddit' submissions/comments, creates video clips, generates background audio, concatenates clips, uploads to YouTube, and logs activity in a tinydb database.","praw, clips, yt_upload, tinydb, json, logging, requests, urllib.error","Reddit API, YouTube API, tinydb, moviepy","praw, tinydb, moviepy, requests",high,6,0
/Users/steven/pythons/apis/askreddit-loop-1.py,"Content Creation, Social Media Automation & Video Processing","Reddit video generator, similar to ask-reddit.py. Scrapes 'AskReddit' submissions, creates video clips, generates background audio, concatenates clips, uploads to YouTube, and logs activity. Designed to run in a loop.","praw, clips, yt_upload, tinydb, json, time, logging, requests, urllib.error","Reddit API, YouTube API, tinydb, moviepy","praw, tinydb, moviepy, requests",high,7,0
/Users/steven/pythons/apis/assemblyai-audio-transcriber.py,Audio Processing & Transcription,"Uses the AssemblyAI API to transcribe audio files. Handles file uploads, requests transcription, polls for results, and saves the transcript as an SRT file.","pathlib, os, time, config, requests",AssemblyAI API,requests,medium,5,0
/Users/steven/pythons/apis/audio-thinketh.py,"Audio Generation, Processing & Content Creation","Cinematic hybrid edition audio generator. Parses .docx files into chapters, synthesizes speech (OpenAI TTS/Hugging Face Bark TTS), applies audio effects (ambience, widening, normalization), and combines into a master MP3.","os, random, pathlib, docx, pydub, requests, logging, dotenv, utils.splitter, utils.mixer, utils.styles, utils.model_select","OpenAI TTS, Hugging Face, pydub","python-docx, pydub, requests, dotenv",high,11,0
/Users/steven/pythons/apis/auth.py,API Authentication Utility,"Provides YouTube authentication functionality. Uses oauth2client to handle OAuth 2.0 flow, including creating credentials from client_secrets.json and authenticating a httplib2.Http object. Returns a YouTube API resource.","functools, googleapiclient.discovery, oauth2client.client, oauth2client.file, oauth2client.tools, typing, asyncio, httplib2, logging","YouTube API, OAuth2","google-api-python-client, oauth2client",medium,8,0
